address,lat,lng
屏東縣內埔鄉內田村光明路224號226號1樓,22.6159388,120.5699036
屏東縣內埔鄉水門村忠孝路289號,22.7053027,120.6397467
屏東縣內埔鄉老埤村壽比路348號,22.6332705,120.598102
屏東縣內埔鄉老埤村學府路1號,22.64303,120.609966
屏東縣內埔鄉和興村學人路592號,22.605003,120.562894
屏東縣內埔鄉東勢村大同路三段2號6號1樓,22.640107,120.576772
屏東縣內埔鄉南寧路19號,22.617291,120.565357
屏東縣內埔鄉黎明村黎東路221號1樓,22.6869107,120.6017819
屏東縣內埔鄉龍泉村昭勝路2號4號6號,22.669506,22.6731659
屏東縣內埔鄉龍潭村昭勝路216號218號220號,22.6731659,120.60065
屏東縣內埔鄉豐田村中正路291號,22.6313231,120.5439392
屏東縣竹田鄉中正路84號86號,22.58539,22.585367
屏東縣車城鄉新街村保新路71號,22.0605846,120.7166075
屏東縣車城鄉溫泉村溫泉路125號,22.0940699,120.7485578
屏東縣車城鄉福安村中山路76號,22.0745224,120.7138647
屏東縣里港鄉三部村三和路1191號,22.8082689,120.5016484
屏東縣里港鄉大平村中山路3號,22.7739083,120.493971
屏東縣里港鄉永春村中山路46號,22.777084,120.4945404
屏東縣里港鄉鐵店村鐵店路171號,22.7779522,120.4980718
屏東縣佳冬鄉玉光村中山路69號,22.4297111,120.5627313
屏東縣佳冬鄉賴家村太平路1號,22.4100707,120.5628587
屏東縣枋山鄉中山路三段61號,22.2446846,120.6627119
屏東縣枋山鄉加祿村加祿路155號,22.3336459,120.6157976
屏東縣枋山鄉枋山村中山路三段38號,22.2429981,120.6650198
屏東縣枋山鄉楓港村10鄰舊庄路21號,22.1947497,120.6918242
屏東縣枋山鄉楓港村舊庄路51之2號3號4號,22.1990132,120.6893959
屏東縣枋寮鄉人和村中山路2段143號,22.3824786,120.5956493
屏東縣枋寮鄉人和村中山路二段232號1樓,22.3845787,120.5953469
屏東縣枋寮鄉安樂村中山路143號145號147號1樓,22.3643334,120.5965146
屏東縣枋寮鄉枋寮村中興路7號1樓,22.3673022,120.5943487
屏東縣東港鎮船頭里船頭路2633號1樓,22.461336,120.4668474
屏東縣東港鎮頂中里延平路107號,22.4676735,120.4486697
屏東縣東港鎮新勝里光復路二段77號1樓,22.4670069,120.4533864
屏東縣東港鎮興台里中山路3號,22.4650694,120.453876
屏東縣東港鎮興東里中正路1段26號,22.4716844,120.4556392
屏東縣東港鎮興東里中正路一段206號1樓,22.473918,120.45861
屏東縣東港鎮興東里中正路二段491號1樓,22.4813128,120.467667
屏東縣東港鎮興東里長春一路95號,22.4715866,120.4592832
屏東縣東港鎮鎮海里鎮海路1100號,22.4626213,120.4439018
屏東縣林邊鄉中山路312號,22.4373747,120.5127151
屏東縣林邊鄉仁和里中山路275號277號,22.4347033,22.4373479
屏東縣長治鄉香楊村瑞光路一段749號1樓,22.6709143,120.5106279
屏東縣長治鄉崙上村中興路3722號,22.690226,120.532836
屏東縣長治鄉新潭村長興路13號1樓,22.6773209,120.5273179
屏東縣長治鄉新潭村長興路326號1樓,22.679324,120.52035
屏東縣南州鄉溪南村三民路171號,22.4895072,120.5065725
屏東縣南州鄉壽元村勝利路515號1樓,22.4914229,120.5374261
屏東縣屏東市一心里廣東南路8815號,22.6646004,120.490993
屏東縣屏東市三山里海豐街712號,22.6996675,120.5093282
屏東縣屏東市大武路122號124號,22.657336,22.657322
屏東縣屏東市大連里廣東路280號2801號,22.6772736,120.5010481
屏東縣屏東市大連里興豐路193號,22.6836883,120.5079337
屏東縣屏東市大連里豐年街1號,22.6760825,120.5087449
屏東縣屏東市仁愛里廣東路561號1樓,22.6835397,120.4980706
屏東縣屏東市仁愛路16號,22.6697779,120.492086
屏東縣屏東市北勢里自由路476號壹樓,22.6834683,120.4904704
屏東縣屏東市北興里中正路443號1樓,22.6894298,120.4988185
屏東縣屏東市北興里廣東路818號,22.6879189,120.4908622
屏東縣屏東市民生東路48號,22.6596685,120.5120027
屏東縣屏東市永安里復興路258號,22.663044,120.487786
屏東縣屏東市和平路2號,22.6655488,120.4788859
屏東縣屏東市信義路73之6 號73之7 號75號1樓,22.6723067,120.4834532
屏東縣屏東市前進里清進巷150號,22.650757,120.464388
屏東縣屏東市崇武里華盛街56號,22.6623572,120.4788734
屏東縣屏東市崇智里光復路104號,22.6699009,120.4850323
屏東縣屏東市崇蘭里自由路593號壹樓,22.6831539,120.4843054
屏東縣屏東市崇蘭里自由路666號1樓,22.683329,120.480941
屏東縣屏東市崇蘭里崇蘭路9824號,22.6874688,120.4809539
屏東縣屏東市清溪里清寧街2號,22.6602163,120.4729374
屏東縣屏東市逢甲路92號,22.6704486,120.486638
屏東縣屏東市勝利路224號,22.679013,120.4779461
屏東縣屏東市博愛路263號1樓,22.679339,120.48093
屏東縣屏東市華山里華正路9號,22.6868688,120.5035418
屏東縣屏東市新生里復興南路一段370號1樓,22.6475072,120.4856602
屏東縣屏東市瑞光里民生路33號,22.6621076,120.50712
屏東縣屏東市瑞光里香楊巷5912號,22.6645969,120.5116014
屏東縣屏東市潭墘里大同北路1號1樓,22.6788598,120.4748841
屏東縣屏東市潭漧里廣東路1588號1590號,22.6828178,120.474938
屏東縣屏東市擇仁里公勇路62號1樓,22.6685348,120.4868595
屏東縣屏東市興樂里杭州街30號1樓,22.6738656,120.491576
屏東縣屏東市龍華里龍華路152號156號1樓,22.6359459,120.4826437
屏東縣屏東市豐源里廣東路86號,22.672013,120.499387
屏東縣恆春鎮南灣里南光路2號,21.9701151,120.7556073
屏東縣恆春鎮南灣里南灣路122號,21.95993,120.76556
屏東縣恆春鎮城北里中正路193號,22.0057507,120.7438595
屏東縣恆春鎮城南里中正路67號1樓,22.0029363,120.7447928
屏東縣恆春鎮恆南路1巷6之1號,21.9980846,120.7444825
屏東縣恆春鎮船帆路720號1樓,21.9341194,120.8233972
屏東縣恆春鎮網紗里省北路45號47號49號1樓,22.010234,22.0101261
屏東縣恆春鎮網紗里省北路510號1樓,22.0244307,120.7432143
屏東縣恆春鎮墾丁里墾丁路166號,21.9452635,120.7987688
屏東縣恆春鎮墾丁里墾丁路333號,21.945836,120.795174
屏東縣恆春鎮墾丁里墾丁路60號1樓,21.943877,120.80135
屏東縣春日鄉七佳村自強一路14號,22.4279696,22.4279186
屏東縣琉球鄉三民區大福村中正路303之2號1樓,22.338766,22.3387568
屏東縣琉球鄉本福村民生路61號,22.3531813,120.3818162
屏東縣高樹鄉南興路74之3號,22.822222,120.602111
屏東縣高樹鄉泰山村產業路73號,22.7871741,120.6140445
屏東縣高樹鄉興中路193號,22.823847,120.5995044
屏東縣新埤鄉新埤村中正路72號,22.4700602,120.5481292
屏東縣新園鄉五房村五房路721號1樓,22.5058326,120.4374554
屏東縣新園鄉仙吉路128號130號132號1樓,22.5431565,120.460991
屏東縣新園鄉共和村光復路1號,22.4740311,120.4442961
屏東縣新園鄉興龍村14鄰南興路319號,22.4917176,120.4590468
屏東縣萬丹鄉大昌路552號556號,22.616254,120.4688225
屏東縣萬丹鄉社中村社皮路三段246號248號1樓,22.6184868,120.4709057
屏東縣萬丹鄉廈北村下蚶18710號,22.5991494,120.4628029
屏東縣萬丹鄉新鐘村萬新路342號,22.561694,120.486677
屏東縣萬丹鄉萬丹路1段21號1樓,22.584578,120.488936
屏東縣萬丹鄉萬丹路一段366號368號1樓,22.5903687,120.4891362
屏東縣萬丹鄉萬全村丹榮路625號,22.5889413,120.4919347
屏東縣萬丹鄉萬後村西環路637號,22.5893889,120.4870349
屏東縣萬巒鄉佳和村佳興路38之9號,22.5724634,120.595248
屏東縣萬巒鄉新置村新隆路75號,22.5264739,120.6248127
屏東縣萬巒鄉萬和村中正路52號1樓,22.5730298,120.5681437
屏東縣萬巒鄉萬金村萬興路18號1樓,22.5970438,120.610533
屏東縣滿州鄉滿州村中山路56號1樓,22.0207158,120.8389884
屏東縣潮州鎮三共里北門路2號,22.5567375,120.5490637
屏東縣潮州鎮三和里延平路189號1樓,22.556054,120.540147
屏東縣潮州鎮三和里延平路89號,22.553639,120.540193
屏東縣潮州鎮中正路1號,22.5514663,120.5385793
屏東縣潮州鎮介壽路145號1樓,22.5427762,120.5359351
屏東縣潮州鎮四維路168號之4,22.5541129,120.5471701
屏東縣潮州鎮永春里光春路139號1樓,22.541514,120.538261
屏東縣潮州鎮永春里興隆路1572號,22.5438671,120.5397862
屏東縣潮州鎮光華里光華路153號1樓,22.5452987,120.543524
屏東縣潮州鎮新榮里中山路121號123號1樓,22.5493543,22.549381
屏東縣潮州鎮潮州路5123號1樓,22.539327,22.5481759
屏東縣麟洛鄉麟趾村中山路5195號,22.6530167,120.5229984
屏東縣麟洛鄉麟蹄村中山路166號1661號1662號1樓,22.6508959,120.5268173
屏東縣鹽埔鄉新二村維新路20號,22.7266921,120.5421113
屏東縣鹽埔鄉維新路1343號136號,22.7423031,120.5577354
屏東縣鹽埔鄉鹽中村勝利路81之3號,22.756474,120.575658
330桃園市桃園區建國路29號,24.9855921,121.3171647
桃園市八德區大明街105號107號,24.9690476,121.2990988
桃園市八德區大勇里忠勇街365號,24.9681447,121.3033349
桃園市八德區大福里介壽路一段134號136號,24.9753271,121.3022445
桃園市八德區中山路166號,24.9267811,121.2843949
桃園市八德區中華路157號,24.9842371,121.2791858
桃園市八德區中華路292號294號1樓,24.9818135,121.2760955
桃園市八德區介壽路一段794號,24.96276,121.29994
桃園市八德區介壽路二段214號1樓,24.9520821,121.2981376
桃園市八德區介壽路二段360號362號,24.9481824,121.2974521
桃園市八德區介壽路二段685巷50弄2號1樓,24.9391654,24.9395392
桃園市八德區永豐路408號410號1樓,24.9721769,121.275108
桃園市八德區永豐路591之1號593號1樓,24.975464,121.271033
桃園市八德區白鷺里永豐南路72號,24.9603995,121.2792591
桃園市八德區和平路122號126號1樓,24.8862068,24.9574906
桃園市八德區和平路8751號,24.9597405,121.3195252
桃園市八德區忠勇街197號,24.9622122,121.3037197
桃園市八德區東勇北路380號,24.9690666,121.3066788
桃園市八德區東勇街3961號,24.9653127,121.309092
桃園市八德區東勇街83號,24.9700449,121.3088697
桃園市八德區建國路1075號,24.9565721,121.2955638
桃園市八德區建國路165號,24.9343779,121.287134
桃園市八德區重慶街172號,24.956063,121.3037461
桃園市八德區高城八街58巷5號1樓,24.9778545,24.9782825
桃園市八德區陸光街45號,24.9612579,121.2976147
桃園市八德區義勇街151號1511號1樓,24.9635183,121.3053717
桃園市八德區榮興路1139號,24.9371212,121.3061168
桃園市八德區福國北街82號,24.9610699,121.2953206
桃園市八德區福國街761號,24.957541,121.2932709
桃園市八德區銀和街65號67號69號,24.9562901,121.2973256
桃園市八德區廣福路162號164號1樓2樓及地下室,24.9596628,121.2955799
桃園市八德區廣福路16號,24.9588469,121.298995
桃園市八德區廣福路578號,24.960484,121.284744
桃園市八德區興豐路340號342號,24.9293187,121.2874609
桃園市八德區興豐路689號1樓,24.9314011,121.2963132
桃園市八德區豐德路31號1樓,24.9247653,121.2947228
桃園市大園區三民路一段785號1樓,25.090048,121.2526448
桃園市大園區三民路二段110號112號,25.0865875,121.2543353
桃園市大園區大工路106號,25.0676034,121.1798451
桃園市大園區大觀路1088號,25.0556633,121.1599095
桃園市大園區大觀路604號606號,25.0622213,121.1756082
桃園市大園區中山南路272號及2721號1樓,25.05963,121.200078
桃園市大園區中正東路102號,25.0626614,121.200714
桃園市大園區中正東路2段428號,25.0279295,121.230318
桃園市大園區中正東路3段620號,25.0044169,121.228549
桃園市大園區中正東路428號,25.0594273,121.2102436
桃園市大園區內海里下厝9之9號1樓,25.0810252,25.0865872
桃園市大園區民族路1號,25.073023,121.190288
桃園市大園區竹圍里五鄰竹圍街453號,25.1046496,121.2432291
桃園市大園區沙崙里國際路二段759號761號763號1樓,25.0906623,121.2297488
桃園市大園區和平西路一段272號274號,25.0473963,121.1877814
桃園市大園區果林里3鄰拔子林23之45號1,25.075888,121.2580991
桃園市大園區埔心里中正東路一段165號1樓,25.049529,121.224328
桃園市大園區航站南路9號2,25.077012,121.231976
桃園市大園區國際路1段3001號1樓,25.070335,121.196724
桃園市大園區新興路62號,25.063413,121.1944977
桃園市大溪區大鶯路15391號,24.9299437,121.3171252
桃園市大溪區中央路152號,24.8827477,121.2876488
桃園市大溪區仁文里介壽路1153號一樓,24.9006308,121.2839133
桃園市大溪區仁和路二段319號321號,24.9059855,121.2615817
桃園市大溪區仁和路二段51號1樓,24.902875,121.268738
桃園市大溪區仁愛里埔頂路1段468號,24.9052268,121.2770529
桃園市大溪區文化路188號,24.8773243,121.2898258
桃園市大溪區民權東路149號,24.8813461,121.2930246
桃園市大溪區石園路615號,24.8672508,121.2563816
桃園市大溪區南興里永昌路320號,24.8968492,121.2618918
桃園市大溪區員林路2段359之1號,24.884293,121.268454
桃園市大溪區員林路3段157號1樓,24.8799949,121.261912
桃園市大溪區員林路一段228號,24.895434,121.2771374
桃園市大溪區埔頂路二段183號,24.9105702,121.2795069
桃園市大溪區康莊路三段20號,24.8614014,121.2823662
桃園市大溪區復興路186號1樓188號1至2樓,24.877906,121.2930719
桃園市大溪區復興路31號1樓,24.8804617,121.2896163
桃園市大溪區復興路一段906號,24.8480859,121.2848268
桃園市大溪區復興路二段35號,24.8297917,121.3063971
桃園市大溪區復興路二段782號786號,24.8320476,121.3303722
桃園市大溪區僑愛一街72巷15號,24.9224414,121.2943256
桃園市大溪區僑愛里介壽路210號,24.9208891,121.2932781
桃園市中壢區九和一街20號之1樓,24.961532,121.223714
桃園市中壢區三光路130號1樓,24.9625674,121.2121609
桃園市中壢區大同路141號143號1樓,24.9565571,121.2219188
桃園市中壢區中山東路三段206號,24.9425394,121.2497999
桃園市中壢區中山路138號,24.9559271,121.2248621
桃園市中壢區中北路158號1樓,24.9568686,121.2394976
桃園市中壢區中北路二段206號,24.952654,121.2282586
桃園市中壢區中央西路一段78號1樓,24.9580619,121.2216661
桃園市中壢區中央西路一段一號一樓,24.957157,121.223337
桃園市中壢區中央西路二段125號,24.959206,121.2148572
桃園市中壢區中央西路二段259號2591號1樓,24.9612656,121.2118312
桃園市中壢區中央東路62號,24.9564471,121.2254414
桃園市中壢區中正路1262號1樓,24.9707532,121.2016864
桃園市中壢區中正路三段134號136號一樓,24.9854139,121.186383
桃園市中壢區中正路四段35號,24.98785,121.181462
桃園市中壢區中和路114號,24.9541311,121.2255098
桃園市中壢區中和路139號,24.9534545,121.2257365
桃園市中壢區中美路二段72號,24.9598518,121.2223637
桃園市中壢區中華路1段670號672號1樓,24.969133,121.2495607
桃園市中壢區中華路2段328號,24.9645195,121.2362662
桃園市中壢區中華路一段560號,24.969882,121.2511673
桃園市中壢區中園路二段138號,24.9923669,121.2342831
桃園市中壢區元化路11號,24.9563477,121.2272407
桃園市中壢區元化路197巷3號1樓,24.9606101,121.2277277
桃園市中壢區元化路307號1樓,24.9621765,121.2250751
桃園市中壢區六和路66號68號,24.9637823,121.2243904
桃園市中壢區日新路112號,24.955411,121.240672
桃園市中壢區日新路66號68號,24.9546019,121.2395351
桃園市中壢區月眉路二段357號1樓部份,25.0102689,121.183835
桃園市中壢區弘揚路47號1樓,24.9533094,121.2404342
桃園市中壢區民族路2段150號152號,24.957635,121.204547
桃園市中壢區民族路6段232號236號1樓,24.9617856,121.1617115
桃園市中壢區民族路三段402號406號,24.960664,121.190086
桃園市中壢區民族路五段451號453號1樓,24.957873,121.1670318
桃園市中壢區民權路2段98號,24.9673567,121.2164978
桃園市中壢區石頭里中和路184號1樓,24.9536458,121.223806
桃園市中壢區光明里中央西路二段49號,24.9586715,121.2172165
桃園市中壢區吉林二路83巷30號32號34號,24.9831631,121.2476965
桃園市中壢區吉林路131號1樓,24.9840418,121.250347
桃園市中壢區吉林路23號1樓,24.9794552,121.2451992
桃園市中壢區同慶路277號1樓,24.9401127,121.25582
桃園市中壢區成章一街10號12號1樓2樓,24.9771306,121.2593415
桃園市中壢區成章二街192號,24.980354,121.257145
桃園市中壢區自強15鄰環中東路8號,24.9672812,121.2603444
桃園市中壢區自強六路53號復華街212號1樓,24.9743568,121.2482165
桃園市中壢區志廣路107號109號1樓2樓,24.9612036,121.2063853
桃園市中壢區定寧路15號,24.993364,121.245142
桃園市中壢區忠孝路248號1樓,24.9784065,121.2545378
桃園市中壢區東園路3號1樓,24.966957,121.239038
桃園市中壢區林森路164號166號168號,24.9444712,121.2266492
桃園市中壢區金鋒四街50巷2號1樓,24.9454837,121.2482676
桃園市中壢區長沙路131號成都路72號,24.949844,24.9297392
桃園市中壢區長沙路8號10號1樓,24.9483544,121.228729
桃園市中壢區長春路23號,24.9789623,121.2498808
桃園市中壢區青昇路257號1樓,25.0155702,121.2204241
桃園市中壢區青埔里高鐵北路1段6號1樓,25.0130935,121.215217
桃園市中壢區信義里福州路201號,24.9499799,121.234331
桃園市中壢區信義里廣州路202號,24.9525066,121.2326968
桃園市中壢區南園二路63號,24.9716044,121.2343117
桃園市中壢區後寮一路140號142號1樓,24.9407805,121.2456754
桃園市中壢區振興里20鄰龍岡路三段192號194號,24.935322,24.9354194
桃園市中壢區晉元路289巷76號,24.9532936,121.2642544
桃園市中壢區健行路230號1樓,24.9471849,121.2283139
桃園市中壢區莒光路35號1樓,24.9526951,121.2381495
桃園市中壢區莊敬路141號,24.9679135,121.2573669
桃園市中壢區莊敬路805號,24.964483,121.2551226
桃園市中壢區莊敬路90號,24.9705993,121.257054
桃園市中壢區普忠路213號,24.9609479,121.246215
桃園市中壢區普義路175號,24.9608463,121.231422
桃園市中壢區華美一路132號136號1樓,24.9532483,121.2609993
桃園市中壢區華勛里華勛街112號114號,24.950601,24.9491679
桃園市中壢區華勛街191號193號,24.9491594,121.2607737
桃園市中壢區慈惠三街152號154號,24.964803,121.2259844
桃園市中壢區新中北路10181號1樓,24.9568317,121.2557357
桃園市中壢區新中北路151號1511號一樓,24.9586868,121.2379999
桃園市中壢區新中北路239號241號1樓,24.9592475,121.239699
桃園市中壢區新中北路465號1樓,24.9581969,121.244877
桃園市中壢區新中北路二段179號181號,24.956203,121.261748
桃園市中壢區新生路232號234號,24.9627531,24.9803459
桃園市中壢區新生路738號740號742號1樓,24.9731512,121.2235889
桃園市中壢區新生路二段378之2號,24.9847591,121.2224716
桃園市中壢區新興路162號,24.9530002,121.2263577
桃園市中壢區溪洲街267巷1號一樓,24.956301,121.2291026
桃園市中壢區萬能路1號,24.9906068,121.2323797
桃園市中壢區實踐路46號,24.9543332,121.2421511
桃園市中壢區榮安一街293號,24.9636009,121.258335
桃園市中壢區榮安十三街297號1樓及榮安十四街2號1樓,24.9610269,24.9622535
桃園市中壢區福州一街242號1樓及2樓,Status: ZERO_RESULTS,NA
桃園市中壢區福州二街392號1樓,24.96755,121.2315901
桃園市中壢區福德路79號81號,24.9748969,121.257742
桃園市中壢區領航北路二段239號1樓,25.0086194,121.2039819
桃園市中壢區領航南路2段208號1樓,25.0039189,121.214416
桃園市中壢區興仁路二段57號1樓,24.9675531,121.2627239
桃園市中壢區興安二街1號,24.9662224,121.2628719
桃園市中壢區興南里新生路182號,24.9613151,121.2230639
桃園市中壢區興國路85號87號一樓,24.9598715,121.2208279
桃園市中壢區龍川街108號110號1樓2樓及112號1樓,24.9345979,121.2465779
桃園市中壢區龍江路62號1樓,24.9316393,121.2571879
桃園市中壢區龍昌路178號1樓1,24.9374949,121.249462
桃園市中壢區龍東路138號140號1樓,24.929076,121.252258
桃園市中壢區龍東路508號510號1樓,24.9349786,121.2569348
桃園市中壢區環北路543號,24.9644607,121.2290588
桃園市中壢區環西路2號,24.9575625,121.2071177
桃園市平鎮區上海路115號,24.9111457,121.2063906
桃園市平鎮區上海路161號,24.9135175,121.2063239
桃園市平鎮區中山路233號235號237號1樓,24.9273712,121.2563345
桃園市平鎮區中央路187號,24.9655747,121.1910358
桃園市平鎮區中興路平鎮段349號351號353號,24.9024683,121.1916156
桃園市平鎮區中豐路一段281之1號1樓,24.9259084,121.2129274
桃園市平鎮區中豐路山頂段479號,24.8940516,121.211766
桃園市平鎮區中豐路南勢二段118號,24.9163082,121.2107582
桃園市平鎮區文化街71號1樓,24.9545712,121.2030663
桃園市平鎮區平東路225號227號229號1樓,24.915723,121.249019
桃園市平鎮區平東路661號,24.912316,121.240113
桃園市平鎮區正義路82號1樓,24.929936,121.222893
桃園市平鎮區民族路3段95號,24.9570214,121.1956895
桃園市平鎮區育達路136號,24.9519557,121.2099547
桃園市平鎮區育達路160號,24.9519065,121.2095729
桃園市平鎮區延平路二段76號,24.9495816,121.2121004
桃園市平鎮區延平路三段246號248號一樓,24.9380869,121.201918
桃園市平鎮區忠孝路69號及廣東段305號306號,24.9544976,121.212832
桃園市平鎮區承德路2號4號1樓,24.9486469,121.219712
桃園市平鎮區東勢里金陵路5段255號,24.9044499,121.231104
桃園市平鎮區東勢里金陵路四段485號1樓,24.911879,121.2311262
桃園市平鎮區金陵路76號78號1樓,24.9487278,121.2229285
桃園市平鎮區金陵路二段104號,24.940928,121.2229013
桃園市平鎮區金陵路三段74號76號,24.92829,121.227218
桃園市平鎮區南平路180之1號,24.9205158,121.2064389
桃園市平鎮區南東路376號1樓,24.9185444,121.2206663
桃園市平鎮區南勢里14鄰中豐路南勢二段377號379號381號,24.9095725,121.2115158
桃園市平鎮區南豐路238號240號1樓,24.8998972,121.205014
桃園市平鎮區南豐路99號,24.9000607,121.2083293
桃園市平鎮區振興西路72號,24.9462533,121.2131124
桃園市平鎮區振興路12號,24.9453541,121.2191617
桃園市平鎮區復旦路二段12351236號1樓,24.9477069,121.2023807
桃園市平鎮區復旦路二段211巷10號1樓,24.94761,24.9514093
桃園市平鎮區復興里文化街241號,24.9514362,121.2033649
桃園市平鎮區湧光里中豐路山頂段206號208號之1樓,24.8993449,121.2107932
桃園市平鎮區湧安里自由街57號59號,24.8923489,24.89229
桃園市平鎮區新富五街9號1樓,24.9397389,121.214358
桃園市平鎮區新富里新富二街18號20號,24.941915,24.9419089
桃園市平鎮區新貴里中豐路一段98號1樓,24.9297276,121.2137001
桃園市平鎮區廣仁里新光路19號21號,24.9405406,24.9404945
桃園市平鎮區廣泰路130號132號,24.9458825,121.2045224
桃園市平鎮區廣達里廣平街20號24號1樓,24.95451,121.2076447
桃園市平鎮區龍南路348號,24.9217169,121.251401
桃園市平鎮區龍德路8號1樓龍福路1號1樓,24.9252379,121.250109
桃園市平鎮區環南路110號,24.9545146,121.2065999
桃園市平鎮區環南路2315號1樓,24.9515207,121.2068918
桃園市平鎮區雙連里民族路雙連三段8號1樓,24.95883,121.1791787
桃園市桃園區力行路7號,25.0030689,121.3049651
桃園市桃園區三民路3段490號,24.9837602,121.307349
桃園市桃園區三民路三段84號86號1樓,24.99474,121.305761
桃園市桃園區上海路54號56號,24.9897603,121.2833394
桃園市桃園區大同路57號59號,24.9893642,24.8593718
桃園市桃園區大有路141號143號,25.0064726,121.3210072
桃園市桃園區大有路547號1樓,25.015109,121.3169191
桃園市桃園區大有路560號1樓,25.0141144,121.3180212
桃園市桃園區大有路660號1樓之2,25.0167573,121.3165978
桃園市桃園區大業路1段54號56號1樓,25.004726,121.317916
桃園市桃園區大業路一段152號,25.0072583,121.3161852
桃園市桃園區大業路一段277號1加2樓,25.0058,121.31639
桃園市桃園區大業路一段355號357號一樓,25.0123071,121.3122934
桃園市桃園區大業路一段426號1樓,25.0148886,121.3117694
桃園市桃園區大業路二段111號之2,25.0183008,25.0183223
桃園市桃園區大興西路一段178號,25.0143959,121.3045654
桃園市桃園區大興西路二段1號1樓,25.0120518,121.3001552
桃園市桃園區大興西路二段253號1樓,25.008314,121.294414
桃園市桃園區大興路221號1樓,25.015956,121.3130927
桃園市桃園區中山北路136號1樓,24.995105,121.303417
桃園市桃園區中山北路42號1樓及地下1樓,24.993175,121.303446
桃園市桃園區中山東路51號1樓,24.9960072,121.3144791
桃園市桃園區中平路102號,24.9873949,121.2927615
桃園市桃園區中平路161號1樓,24.9856776,121.2936451
桃園市桃園區中正五街137號139號1樓,25.0057827,121.3022859
桃園市桃園區中正路1087號1樓,25.0167026,121.2979969
桃園市桃園區中正路233號1樓,24.9958372,121.3101337
桃園市桃園區中正路324號,24.9978341,121.3092165
桃園市桃園區中正路455號,25.001262,121.306765
桃園市桃園區中正路612號,25.004803,121.3048477
桃園市桃園區中埔二街150號,25.0125815,121.2957549
